,Position,City,Job Title,Salary Estimate,Job Description,Rating,Company Name,Location,Headquarters,Size,Founded,Type of ownership,Industry,Sector,Revenue,Competitors
93,Software engineer,San Francisco,"Senior Software Engineer, Frontend",-1,"What You'll Be Doing


At Fictiv, we help product innovators to create. Fictiv brings a modern, friendly experience to manufacturing that makes it easy to turn designs into real products. You will use the latest technologies (React, Redux, Apollo GraphQL) to iterate quickly and ensure a rapid feedback loop between us and our customers.

Senior engineers are the heart of our engineering team at Fictiv. As a Senior Engineer, you will be the hands-on technical anchor for your team. You will guide decisions from inside a project and lead us to build thoughtful, intuitive web applications with modular, well-structured components. You are a champion for the quality of our product, a key contributor to our architecture, and the go-to expert for upleveling the skills of our engineers.

Desired traits
Bring out the best in the team You use influence and knowledge to lift the team to high standards of excellence not only in application design and code quality but also in collaboration and development practices.
Technical expertise You have extensive experience building performant, scalable web applications. You think deeply about how data is fetched, cached, and updated to provide a seamless user experience.
Deliver quality You have a high attention to detail and hold both yourself and your colleagues accountable for shipping polished, well-tested code.
Team-oriented You have a strong desire to help the entire team level up and improve our collective craft. You understand, as a leader, the outsized impact of your actions and behaviors.
What It's Like to Work at Fictiv


We're a small, close-knit team with a core group in San Francisco and a few remote engineers around the country. While all engineers need protected time to get things done, we also believe collaboration and creative tension create the best product. That's why we encourage a rhythm of heads down, independent work followed by focused constructive debate.

Product development teams follow the principles from the Scrum Guide. We're practical about process (we use what works), but we've found Scrum ceremonies to be a positive framework for transparency and collaboration. To save time, we keep Sprint Plannings to 1 hour and Sprint Reviews to 45 minutes for our two-week sprints.

Since we are a small team, all engineers (including managers) are on-call for two weeks out of every 8-10 weeks. This builds team cohesion and deepens our understanding of our production system. We are all here to support one another, so if you have personal events during this time we're happy to swap slots or cover for you.

We're constantly evolving our practices, so please feel free to ask questions and share your thoughts as well!

What's In It For You


We strive to contribute to the well-being of our team beyond Health (of which we pay 85% per employee and 60% for dependents which an increase in contribution in January), Dental and Vision insurance. We offer our team members the following:
Investment in Health & Wellness (we offer everything from virtual vinyasa to pilates classes)
Access to professional development & coaching with additional free membership with Udemy, offering virtual learning via access to 4,000 courses
Equal maternity & paternity leave
Ergonomic investment in your personal/home office while working virtually
Investment in Diversity & Inclusion (executive-sponsored D&I programs)
Community days where you contribute to your community and enrich both yourself and organizations of your choice. Each year, you can use up to two days as community days.
Happy hours and demo days to showcase what you're working on and AMA's from the Executive team!
About Fictiv (www.fictiv.com)


At Fictiv, we're inspired every day by our customers and teammates.

We support a community that includes some of the most talented people on the planet. You'll design for hardware engineers who are literally building the future today (think autonomous vehicles, spaceships, next-gen medical devices) and partner with some of the most skilled manufacturers who produce the seemingly impossible.

For decades, these innovators have had to endure long feedback cycles and high upfront costs to bring their products to market. Our system drastically reduces the time and cost while allowing hardware engineers to experiment faster and with better outcomes. Come play a critical role in shaping this system into becoming the go-to platform for hardware development.

We're actively seeking potential teammates who can bring diverse perspectives and experience to our culture and company. We believe inclusion is the best way to create a strong, empathetic team. Our belief is that the best team is born from an environment that emphasizes respect, honesty, collaboration, and growth.

We encourage applications from members of underrepresented groups, including but not limited to women, members of the LGBTQ community, people of color, people with disabilities, and veterans.",4.1,"Fictiv
4.1","San Francisco, CA",-1,51 to 200 Employees,2013,Company - Private,Consumer Products Manufacturing,Manufacturing,Unknown / Non-Applicable,-1
94,Software engineer,San Francisco,"Software Engineer, University Graduate",-1,"Position Overview


SingleStore Software Engineers are at the forefront of real-time technology that's revolutionizing how companies run their businesses everyday. With release cycles throughout the year, our engineers are accustomed to moving quickly in a rapid production environment. To do this successfully, we work collaboratively and creatively across teams to maximize our opportunity for impact. We also believe it's important to celebrate our wins together whether it be at local spot or getting out of the city for some exploring.

As a Software Engineer, you will be empowered to own your projects end-to-end and be an active contributor throughout the product life cycle. To expedite your growth path, you will partner with engineers who deeply care about your success and will lend their expertise to your professional development. Our engineers are not just technical partners, but are also business partners who are exposed to all areas of the business, working with teams such as product, marketing, and sales.

Role and Responsibilities


Our Software Engineers work on small, collaborative teams to help drive our company forward. Whether you're building new features in Javascript and React.js, increasing the runtime and performance of a SingleStore cluster, or writing new C++ code for the query optimizer, our University Graduates are responsible for brand new and existing projects that are deployed into production with each release. Your work will include everything from writing to testing software, and you'll gain a significant understanding of both the product and the business.

Required Skills and Experience
B.S. Degree in Computer Science, Electrical Engineering, Computer Engineering, or related discipline
Deep understanding of C.S. fundamentals
Strong programming skills with Python, Go, C, C++, or JavaScript
Passionate about building highly reliable software
Firm grasp of algorithms and data structures
SingleStore is one platform for all data, built so you can engage with insight in every moment. Trusted by industry leaders, SingleStore enables enterprises to adapt to change as it happens, embrace diverse data with ease, and accelerate the pace of innovation. SingleStore is venture-backed and headquartered in San Francisco with offices in Portland, Seattle, Boston, Bangalore, London, Lisbon, and Kyiv. Defining the future starts with The Database of Now™.

Consistent with our commitment to diversity & inclusion, we value individuals with the ability to work on diverse teams and with a diverse range of people.

To all recruitment agencies: SingleStore does not accept agency resumes. Please do not forward resumes to SingleStore employees. SingleStore is not responsible for any fees related to unsolicited resumes and will not pay fees to any third-party agency or company that does not have a signed agreement with the Company.",4.6,"SingleStore
4.6","San Francisco, CA",-1,201 to 500 Employees,2011,Company - Private,Enterprise Software & Network Solutions,Information Technology,Unknown / Non-Applicable,-1
95,Software engineer,San Francisco,Senior Software Engineer,-1,"Introduction

ASML US brings together the most creative minds in science and technology to develop lithography machines that are key to producing faster, cheaper, more energy-efficient microchips. We design, develop, integrate, market and service these advanced machines, which enable our customers - the world’s leading chipmakers - to reduce the size and increase the functionality of their microchips, which in turn leads to smaller, more powerful consumer electronics. Our headquarters are in Veldhoven, the Netherlands, and we have 18 office locations around the United States including main offices in Chandler Arizona, San Jose and San Diego California, Wilton Connecticut, and Hillsboro Oregon. Having joined the ASML family in 2016, HMI has become an integral part of our holistic lithography portfolio with innovative e-beam inspections solutions.

Job Mission

To be completed

Job Description

To be completed

Education

To be completed

Experience

To be completed

Personal skills

To be completed

Context of the position

To be completed

Other information

To be completed

EOE AA M/F/Veteran/Disability",3.9,"ASML
3.9","San Jose, CA",-1,10000+ Employees,1984,Company - Public,Electrical & Electronic Manufacturing,Manufacturing,$5 to $10 billion (USD),-1
96,Software engineer,San Francisco,Software Development Engineer I - Ad Products,-1,"About Us

Launched in 2011, Twitch is a global community that comes together each day to create multiplayer entertainment: unique, live, unpredictable experiences created by the interactions of millions. We bring the joy of co-op to everything, from casual gaming to world-class esports to anime marathons, music, and art streams. Twitch also hosts TwitchCon, where we bring everyone together to celebrate, learn, and grow their personal interests and passions. We're always live at Twitch. Stay up to date on all things Twitch on LinkedIn, Twitter and on our Blog.

About the Role

Twitch enables content creators to live-stream content to their communities across the globe. Advertising is a core part of Twitch's business model, and spans across many product areas. We take pride in our mission to help creators earn a living by entertaining and educating their viewers. On the Advertising team you'll work with a passionate, and customer obsessed team. We are a growing team of product and engineering professionals based in the Twitch HQ at downtown SF.

Twitch is looking for backend and full stack engineers with the curiosity and creativity to develop user experiences, services and APIs that grow the advertising and promotion business. These systems give creators opportunities to make money, the data they need to do this well

The ideal contributor has experience building and delivering high-quality production, UXs and web services in a distributed systems environment.

As the leader in this space, Twitch has a unique opportunity to invent what advertising as a product means in a live-streaming context. Our products include creative real-time experiences specific to Twitch. If you're excited about having an outsize impact in an area that's ripe for innovation, come work with us!

You Will:
Develop, deliver, and operate new product services and features on native AWS infrastructure
Scale and improve existing APIs and services used to power the Twitch advertising platform
Improve engineering processes and tools to increase team effectiveness
Contribute to overall team and organization technical strategy and architecture design
Work across teams and organizations to deliver value to our creators, viewers, and advertisers
You Have:
2+ years of experience (internship or professional) developing distributed services, and/or high-volume data processing workflows
Proficient coder in one or more of the following: Go, Java, Python
Experience developing and operating high-volume low-latency distributed services, and/or high-volume data processing workflows
Bachelor's degree or above in Computer Science or related field
Bonus Points
Experience refining technical strategy and mentoring engineers
Experience or familiarity with the AWS ecosystem of services (EC2, RDS, Dynamo, Lambda, and CloudWatch)
Experience or familiarity with Data pipelines (Kinesis, Airflow, Redshift, or Spark)
Experience or familiarity with experience building GraphQL APIs
Experience or familiarity with Docker, Kubernetes and the container ecosystem
Perks
Medical, Dental, Vision & Disability Insurance
401(k)
Maternity and Parental Leave
Flexible PTO
Commuter Benefits
Amazon Employee Discount
Monthly Contribution and Discounts for Wellness Related Activities & Programs (e.g., gym memberships, off-site massages)
Breakfast, Lunch & Dinner Served Daily
Free Snacks and Beverages

We are an equal opportunity employer and value diversity at Twitch. We do not discriminate on the basis of race, religion, color, national origin, gender, sexual orientation, age, marital status, veteran status, or disability status.

Pursuant to the San Francisco Fair Chance Ordinance, we will consider for employment qualified applicants with arrest and conviction records.",3.4,"Twitch
3.4","San Francisco, CA",-1,1001 to 5000 Employees,2011,Subsidiary or Business Segment,Internet,Information Technology,Unknown / Non-Applicable,-1
97,Software engineer,San Francisco,"Data Engineer, Education",-1,"Founded by Dr. Priscilla Chan and Mark Zuckerberg in 2015, the Chan Zuckerberg Initiative (CZI) is a new kind of philanthropy that's leveraging technology to help solve some of the world's toughest challenges – from eradicating disease, to improving education, to reforming the criminal justice system. Across three core Initiative focus areas of Science, Education and Justice and Opportunity, we're pairing engineering with grantmaking, impact investing, policy work, and movement building, to help build an inclusive, just and healthy future for everyone.

Our Values


We believe we can help build a future for everyone.
We aim to be daring, but humble: We look for bold ideas — regardless of structure and stage — and help them scale by pairing engineers with subject matter experts to build tools that accelerate the pace of social progress.
We want to learn fast, but build for the long-term: We want to iterate fast and help bring new solutions to the table, but we also realize that important breakthroughs often take decades, or even centuries.
Stay close to the real problems: We engage directly in the communities we serve because no one understands our society's challenges like those who live them every day.
Our success is dependent on building teams that include people from different backgrounds and experiences who can challenge each other's assumptions with fresh perspectives. To that end, we look for a diverse pool of applicants including those from historically marginalized groups — women, people with disabilities, people of color, formerly incarcerated people, people who are lesbian, gay, bisexual, transgender, and/or gender nonconforming, first and second generation immigrants, veterans, and people from different socioeconomic backgrounds.

The Opportunity


Our goal is to provide every student, and every teacher, the opportunity to reach his or her full potential. The Chan Zuckerberg Initiative supports and develops personalized learning experiences that are passionate about and led by the learner - meeting them where they are cognitively, physically, socially and emotionally. We're looking for engineers to help bring a new personalized learning platform to the globe's generation of students and help advance the potential of humanity.

You will
Support data scientists' access to data that is accurate, easy to access, and reliable
Maintain key data pipelines
Ingest external data sets for use by the team
Improve data usability and data quality in our data warehouse
Launch new ETL (extract, transform, load) processes in production
Identify impactful improvements to our data warehouse infrastructure
Understand and improve the workflow of initiative members who use data for decision making
Help members of the initiative adopt and use tools that improve their access to data needed for their work
Educate initiative members about standard methodologies for use of data
You have
Experience in Software Engineering or Data Engineering
Expertise writing efficient and optimized SQL
Experience with dimensional data modeling and schema design in a database or data warehouse
Expertise with scripting languages such as Python
Experience with ETL tooling such as Airflow
Experience with large scale cloud data warehouses such as Snowflake
Passionate about education and bringing technology to improving education
Experience working with large data sets
Loves to collaborate and work people in understanding data needs as well as scoping and executing on projects.",3.7,"Chan Zuckerberg Initiative
3.7","Redwood City, CA",-1,201 to 500 Employees,2015,Company - Private,Computer Hardware & Software,Information Technology,Unknown / Non-Applicable,-1
98,Software engineer,San Francisco,Senior Fullstack Engineer,-1,"About us:
Grand Rounds is a new kind of healthcare company. Founded in 2011, the company is on a mission to raise the standard of healthcare for everyone, everywhere. The Grand Rounds team goes above and beyond to connect and guide people to the highest quality healthcare available for themselves and their loved ones. Grand Rounds creates products and services that give people the best possible healthcare experience. Named a 2019 Best Place to Work by Glassdoor and Rock Health’s 2018 Fastest Growing Company, Grand Rounds works with inspiring employers and doctors to empower them to be the change agents we need to make our shared vision a reality.

Our Team’s Impact:

Our Product Engineering team collaborates closely with Product and Design to scale and strengthen the Web, iOS and Android experience for all of our audiences. Our products create a powerful and personalized navigation experience for Members to connect them with high quality medical providers, provide advice and guidance on healthcare decisions, and facilitate expert opinions on diagnoses and treatment plans. We also build the platform and workflow apps that enable our Care Team to best support our Members through their healthcare journey.

About The Role:

As a senior software engineer on our Member Experience team, you will work on and build our core product that enables millions of users to achieve better healthcare outcomes. As a software engineer on this team, you will be the architect, designer and coder of the project. You’ll work closely with the product management, design and other engineers to make the team’s vision a reality. You’ll have the opportunity to lead cross-team efforts, mentor your team members and establish engineering best practices across Grand Rounds.
What You’ll Do:
Build out our member experience, as we add new services in areas like financial guidance and appointment scheduling.
Help us evolve and improve the architecture, performance, and operability of our systems.
Drive features and products through the full development lifecycle.
Collaborate with tight-knit teams - teach us what you know and learn from us.
Build systems which support privacy and security for sensitive personal and medical data.
Mentor other engineers on a variety of topics: engineering standard methodologies (coding, frameworks, architecture, CI/CD), project management (task planning), and career growth.
Your Qualifications:
Proven full-stack development and leadership experience
Analytical, problem-solving and troubleshooting skills
Experience with (and fondness for) automated testing
Hands-on experience with back-end development
Familiarity with modern frontend frameworks
Experience creating and maintaining APIs (REST, GraphQL, etc.)
Modeling real-world data in both RDBMS and NoSQL persistence layers
Experience in our current technologies is a bonus: Go, Javascript, React, Rails, GraphQL, Docker, AWS
Our depth of data is unique, and our platform is full of possibilities. We are looking for motivated talent who wants to take our technology and business to the next level to disrupt the healthcare industry as we know it today.

Ind11
Grand Rounds is an Equal Opportunity Employer and considers applicants for employment without regard to race, color, religion, sex, orientation, national origin, age, disability, genetics or any other basis forbidden under federal, state, or local law. Grand Rounds considers all qualified applicants in accordance with the San Francisco Fair Chance Ordinance.",4.3,"Grand Rounds
4.3","San Francisco, CA",-1,501 to 1000 Employees,2011,Company - Private,Health Care Services & Hospitals,Health Care,Unknown / Non-Applicable,-1
99,Software engineer,San Francisco,Software Engineer - Commerce Platform,-1,"About The Team:


The Commerce Platform team is responsible for building services that enable seamless customer payments to drive growth for the business. Additionally, the team builds and maintains product features that help improve transparency, control, and accuracy of subscription information for our customers.

What you'll do:
Work closely with Product Managers and Client Teams to build features that make payments easy, seamless, and secure for our customers
Actively own features and/or systems and define their long term health
Improve engineering standards, tooling, and processes
Basic Qualifications:


BS in Computer Science or related field of study.
3+ years of experience programming in Java, C#, or other modern programming languages
Consistently delivered high-quality software in a timely manner

Preferred Qualifications:


Designed and built microservices with a focus on scale, reliability, availability
Familiarity with containerization using Docker or similar technologies
Past experience with Billing platforms and services (Zuora, Braintree, PayPal), multi-currency, payment processing, subscription
Deployed software in Google, AWS, Azure, or similar cloud-native technologies
We are committed to an inclusive and diverse Evernote. We believe that different perspectives lead to better ideas, and better ideas allow us to better understand the needs and interests of our diverse, global Evernote Community. We welcome people of different backgrounds, experiences, abilities and perspectives and are an equal opportunity employer.

California privacy notice: Read our privacy policy for job applicants here.",4.2,"Evernote
4.2","Redwood City, CA",-1,201 to 500 Employees,2008,Company - Private,Computer Hardware & Software,Information Technology,$50 to $100 million (USD),-1
100,Software engineer,San Francisco,Automation Workflow Engineer,-1,"The Automation Workflow Engineer within the Process Development group contributes to the development and implementation of automation systems and processes to support oligonucleotide manufacturing. This person interacts with a team of database developers, scientists, engineers and production managers on projects to conceptualize, design, develop, and implement solutions to create new capabilities and to optimize the performance of existing laboratory processes.

Areas of Responsibility:

Configure, program and troubleshoot automation systems commonly used in the biotechnology industry, such as Hamilton, Tecan, or similar.
Gathers user/stakeholder needs, develops requirements, develops process specifications, develops process or system architectures to meet those specifications and requirements, writes scripts, instrument methods, conducts unit testing, V&V activities, and conduct post launch support.
Interface with stakeholders in reviews and routine meetings.

To perform this job successfully, an individual must be able to perform each essential function satisfactorily.

Essential Functions:

Develop and integrate automation systems with related software tools.
Integrate ancillary robotics such as swap arms or similar.
Refine needs into requirements, derive specifications from requirements
Map specifications and requirements into system or process architectures
Oversee the testing associated with installation and operational qualifications, method validations and continued method verification.
Interface directly with database developers to ensure proper communication between database/automation systems.
Provide end user documentation/education to manufacturing staff to operate and perform basic troubleshooting for robotic systems.
Work closely with R&D and manufacturing groups to develop workflows for new products and or develop new processes for existing products.
Work closely with manufacturing groups to identify and implement process improvements.
Stay abreast of developments in laboratory automation and recommend upgrades / new systems.

Other Skills and Abilities:

Excel macro scripting ability is a must.
Exposure to system architecture tools is a plus
Fluency in one or more instrument programming languages is a must.
Understanding of Lean Six Sigma is a plus.
Exposure to discrete event simulation is a plus.
Experience with relational databases is a plus.

CA1

Qualifications

Education/Experience:

B.S. / M.S. in an Engineering or Science discipline, with a minimum of 3 years of relevant industrial experience.",-1,LGC Limited,"Petaluma, CA",-1,Unknown,-1,Company - Public,-1,-1,Less than $1 million (USD),-1
