,Position,City,Job Title,Salary Estimate,Job Description,Rating,Company Name,Location,Headquarters,Size,Founded,Type of ownership,Industry,Sector,Revenue,Competitors
0,Software engineer,San Francisco,Software Engineer (Backend),-1,"Our Company
Afterpay has transformed the way people pay by allowing shoppers to receive products immediately and pay in four simple installments over a short period of time.The service is completely free for customers who pay on time - helping consumers spend money responsibly, without incurring interest, fees or revolving and extended debt. Afterpay is offered by more than 42,500 of the world’s best retailers and has more than 6.6 million active customers globally. The solution is currently available in Australia, New Zealand, the United States and the United Kingdom where it is called Clearpay. Afterpay is on a mission to be the world’s most loved way to pay.

In the U.S., more than 3.3 million customers use Afterpay and the service is offered by more than 9,000 of the top fashion and beauty retailers across the country including Anthropologie, Forever 21, DSW, GOAT, Finish Line, Levi’s, Mac Cosmetics, Ray-Bans and many others. Afterpay’s U.S. headquarters are located at the heart ofthe retail and business district in San Francisco, California


The Role
Afterpay has a unique opportunity for a Backend Software Engineer to join our team and make an immediate impact on our product by getting involved early on at our San Francisco office. The Backend Software Engineer will influence many aspects of our business through architecting our core systems. This is an exciting opportunity to make a direct, tangible impact on our product and work on projects that are pivotal to our team’s success and our company’s growth.



What You’ll Be Doing
Building our core systems that serve our customers, merchants, risk engines and core payment processing
Contributing to our large-scale applications written primarily in Java and Python
Collaborating with our cross-functional teams consisting of designers, product managers, and QA in an agile, fast-paced environment


What you've Accomplished
Experienced in building and maintaining applications that utilize a modern programming language, mainly Java and Python
Serious about testing and have experience with automated testing frameworks
Enthusiastic about solving business problems with technology and can take ownership of an end-to-end solution
Passionate about continuously learning new technologies, frameworks, and services
Possess an execution mindset and the ability to deliver with cross-functional teams that are globally distributed
BA/MS/PhD in computer science or a related field preferred


What We Offer
Competitive compensation
Medical, dental, vision insurance (100% covered!)
Mobile reimbursement and travel/commuter benefits
Mentorship and growth opportunities- A beautiful office space in downtown San Francisco


How to apply
If you’re excited by the opportunity to work in a fast growth organization, where there’s plenty of opportunities to pitch in on projects and learn new skills, please click apply now!


Afterpay is continuing to hire for all open roles with all interviewing and on-boarding done virtually due to COVID-19. All new team members, in addition to current staff, will temporarily work from home until it is safe to return to our offices.",3.8,"Afterpay
3.8","San Francisco, CA",-1,501 to 1000 Employees,2014,Company - Public,Internet,Information Technology,$5 to $10 million (USD),-1
1,Software engineer,San Francisco,Full Stack Software Engineer,-1,"Ike’s mission is to make trucks safer, truckers more valuable, and trucking more efficient. Our team is comprised of prominent experts in a wide variety of fields. We are unified by a common passion to transform the way the world moves and build a real commercial product at scale.

About Your Team
Software Infrastructure team serves as the platform which powers autonomy algorithms both onboard and offboard. We are providing computing, storage, communication and data center services & tools to enable autonomy stack to run onboard on the vehicle and offboard inside the data-center. We also provide infrastructure software to support offline machine learning training, data pipelines and simulation for validation and verification.

About Your Role
You will be a key contributor on a small, collaborative team focused on one of the most exciting robotics applications today. As a full stack software engineer, you will specifically play a major role in designing, developing, deploying and supporting Ike’s web development technologies. You will lead Ike’s information representation, UI design and full stack web applications. The list of applications is growing everyday along with the rapid business growth. Web applications serve as interfaces for both internal and external users and it’s the one-stop shop to visualize how well our system is performing.
About Your Work
Build highly-reliable and scalable full-stack products by taking advantage of modern full-stack framework’s features and flexibility
Build complex applications using technologies such as React, Ember, or Angular
Design service application interface, data models for different use cases; integrate with cloud based databases and work in large datasets; build innovative solutions involving huge datasets of imagery and sensor data
Write maintainable and extensible front-end and backend code with high quality tests and documentation, using JavaScript, Python, Golang
Further advance the cutting-edge technology and contribute production quality code to open source projects
Deploy services in cloud based orchestration system such as kubernetes; work with reliability engineers to setup proper monitoring and alerting
About You
BS, MS, or equivalent experience, in Computer Science, Computer Engineering or similar with several years of experience in software development
Expert on web technologies. you've built side projects or professionally utilize the latest stacks and libraries such as Node.js, React, Angular, Rails, Ember, CSS frameworks etc.; you are excited by the amazing pace that the web continues to evolve; you seek new methods and tools to make great web tools faster and better, both on the front-end and back-end; familiarity with principles of architecture patterns and good user experience
Experience with developing, deploying, monitoring services in production environments
Comfortable working across teams and organizations to drive the finish line
Nice to Have
Experience building production cloud infrastructure software
Experience with building user interfaces on Linux Qt environment with C++
Cloud infrastructure like AWS/GCP
Experience in self-driving industry

Please note - we are not currently hiring new graduates for this role. We may post new graduate roles in the future though, so stay in touch by following us on LinkedIn!

Ike is an equal opportunity employer. We celebrate diversity and are committed to building an inclusive environment for all employees. We never discriminate on the basis of race, creed, color, ethnicity, national origin, religion, gender, sex, sexual orientation, gender expression, age, height, weight, veteran status, marital status or disability status.",4.9,"Ike
4.9","San Francisco, CA",-1,51 to 200 Employees,2018,Company - Private,Trucking,Transportation & Logistics,Unknown / Non-Applicable,-1
2,Software engineer,San Francisco,Software Engineer,-1,"Overview

Under general supervision, the Software Engineer is responsible for applying their skills and expertise leading to software solutions that improve the accuracy, efficiency, thoroughness and speed at which staff can perform their duties.

Responsibilities

Include, but are not limited to the following:
Assist with the planning and engineering of software solutions.
Develop, test, deploy and maintain customized software solutions.
Create database solutions, deploy and test to ensure optimal functionality.
Create standard operating procedures to ensure databases are being consistently maintained.
Create flowcharts and other documentations to identify requirements for software and to propose possible solutions.
Apply computer science, engineering, and mathematical analysis to the software development process.
Coordinates with internal departments and other staff to forecast whether the design will be feasible under cost and time constraints.
Communicate with customers and clients to establish maintenance procedures for software systems.
Ability to solve complex mathematical equations by applying geometry, trigonometry and calculus in the software domain.
Research, develop, and present new ideas to internal customers that effectively improve the core business and engineering processes.
Make recommendations to improve and promote quality and efficiency.
Performs other related duties as assigned.

Qualifications

Include, but are not limited to the following:

EDUCATION/ EXPERIENCE

Bachelor's Degree (B.S) in Computer Science, Software Engineering, or Mathematics required.
At least five plus (5+) Years of full-time dedicated professional software development / programming experience.
Has designed, built, deployed and managed MySQL and/or SQL Server database solution(s) in a multi-user, multi-site, enterprise environment.
Authored and deployed services for Windows servers and .Net client-server solutions for desktop.
Competent in Software language skills: Microsoft .Net, SQL, C++.
10 + Years of full-time dedicated professional software development / programming experience preferred.
Proficiency with AutoCAD, Revit or equivalent design software preferred
Excel experience developing smart spreadsheets and calculators preferred

SKILLS/ABILITIES

Strong communication skills in the English-language written and verbal.
Exhibits professional nonverbal communication skills.
Ability to present numerical data effectively both verbal and written.
Ability to work effectively in a team environment.
Proficiency in MS Office applications (Word, Excel, etc.).
Strong problem solving and analytical skills.
Maintain professional behavior and appearance.
Exhibit dependability and accountability.
Demonstrated ability to multi-task on multiple projects.

PHYSICAL REQUIREMENTS:

Regularly sit, stand, and walk for long and short distances.
Required to hear with or without correction to be able to interpret and receive information and directions.
Regularly required to communicate: verbal and written, in order to describe and explain detailed, important, and accurate instructions.
Occasionally lift and/or move material up to 25lbs.
Occasionally stoop, kneel, or crouch.
Noise level is usually moderate.

PI125406503",-1,Construction Innovations Corporate (Sacramento),"Rancho Cordova, CA",-1,-1,-1,-1,-1,-1,-1,-1
3,Software engineer,San Francisco,"Lead Software Engineer, Dir.",-1,"Job Description:

Acts as a team lead of a software development team and provides business support for the production systems in assigned business units. Leads in all phases of the system development life cycle. Plans, monitors, designs, develops, integrates, and implements custom and packaged solutions to achieve business goals. Architects solutions that are fit for purpose and mentors more junior staff to ensure overall quality. Manages internal client relationships to resolve complex support issues.

Major Accountabilities :

Engineer Responsibilities:

Lead in project analysis, design, and implementation phases
Analyze project requirements and accordingly decide on technical and functional direction
Prepare user requirements, technical specifications, and design specifications
Develop new software and modify existing software when required
Lead in the definition of coding standards and lead the Peer Code Review processes
Lead technical support of system acceptance testing and validation activities
Define the appropriate agile processes to be adopted for a given project and provide leadership as required
Drive the continuous improvement of engineering processes
Lead system maintenance and oversee periodic review processes
Review and decide upon improvements to existing system designs
Deliver solutions to improve system performance and reliability
Respond to customer queries and concerns in a timely fashion. Track issues, determine trends, and drive new designs to eliminate future issues.
Lead meetings with teammates and business partners to discuss new ideas, issues and projects
Perform system failure analysis and drive corrective actions. Lead root cause analysis and determine long term solutions.

Lead Responsibilities:

Lead a team of employees/consultants
Delegate tasks and set deadlines
Monitor team performance and report on metrics
Discover training needs and provide coaching
Ensure that the team is consistently delivering working software to the highest standards
Verify that the team is adhering to our commitment of principles and practices
Understand and communicate process methodologies used in the bank
Provide technical guidance in planning and executing assigned projects
Communicate information to management including escalation of key issues and risks

Education/Experience/Skills/Knowledge :

Education: Bachelor's degree in Computer Science, Accounting, and Finance, or a related field, or equivalent work experience, is required.

Experience:
Minimum of 10 years of computer systems experience involving installing, supporting, and using information technology in a large, regulated financial services (preferably banking) environment is required.

Skills & Knowledge :

Working knowledge of Treasury and Capital Markets is highly desirable.
Understanding of operating systems, application security configurations, and best practices in Windows and UNIX environment is required.
Ability to take the initiative to pursue assignments, responsibilities, and support requests to a logical and final solution and to employ System Development Life Cycle (SDLC) standards is required.
Demonstrated knowledge and experience:
Minimum of 6 years of Microsoft .Net experience of proposing, documenting technology solutions and development experience of client applications, web services, and web applications.
Minimum of 2 years of java experience of proposing, documenting technology solutions and development experience of client applications, web services, and web applications
Minimum of 2 years knowledge of VBA with Microsoft Excel, Access.
Relational Database Management Systems: Oracle and SQL Server, including PL/SQL and expert SQL
Implementing code using design patterns, unit testing and mocking frameworks
Market data and market platforms such as Reuters, Bloomberg and Intex
Knowledge of fixed income and derivatives instruments
Experience with the integration of custom financial applications with packaged systems would be beneficial.
Experience with third party valuations and risk systems such as: Numerix, QRM, Polypaths or any other valuation and risk system would be beneficial.
Understanding of fixed income and derivatives instrument valuation would be advantageous.
Knowledge and experience of full stack web application development and client-side frameworks would be advantageous e.g. HTML5, JQuery, AngularJS, Bootstrap, Typescript/Javascript.
Experience with cloud-based technologies would also be advantageous e.g. CloudFormation, API Gateway, Lambda etc.
Excellent verbal and written communication skills and strong analytical and problem-solving skills

Qualifications:

The Federal Home Loan Bank of San Francisco is an Equal Employment Opportunity employer and is committed to a diverse workforce. We value and actively seek to recruit, develop, and retain individuals with varied backgrounds and experiences reflecting the full diversity of the communities that we serve. It is the policy of the Bank to comply with all applicable laws concerning the employment of persons with disabilities.",2.5,"FHLBank San Francisco
2.5","San Francisco, CA",-1,201 to 500 Employees,1932,Company - Private,Banks & Credit Unions,Finance,$1 to $2 billion (USD),-1
4,Software engineer,San Francisco,Software Engineer,-1,"201 Third Street (61049), United States of America, San Francisco, California

Software Engineer

Do you love building and pioneering in the technology space? Do you enjoy solving complex business problems in a fast-paced, collaborative, inclusive, and iterative delivery environment? At Capital One, you'll be part of a big group of makers, breakers, doers and disruptors, who love to solve real problems and meet real customer needs.

We are seeking Software Engineers who are passionate about marrying data with emerging technologies to join our team. As a Capital One Software Engineer, youll have the opportunity to be on the forefront of driving a major transformation within Capital One. Learn more about #lifeatcapitalone and our commitment to diversity & inclusion by jumping to slides 76-91 on our Corporate Social Responsibility Report.

What Youll Do:
Collaborate with and across Agile teams to design, develop, test, implement, and support technical solutions in full-stack development tools and technologies
Work with a team of developers with deep experience in machine learning, distributed microservices, and full stack systems
Share your passion for staying on top of tech trends, experimenting with and learning new technologies, participating in internal & external technology communities, and mentoring other members of the engineering community
Collaborate with digital product managers, and deliver robust cloud-based solutions that drive powerful experiences to help millions of Americans achieve financial empowerment
Work with cloud native stack, build on AWS, use technologies like Kubernetes and Serverless
Basic Qualifications:
Bachelors Degree
At least 2 years of experience in software engineering
Preferred Qualifications:
Master's Degree
2+ years of experience in Agile practices
1+ years of experience with AWS, GCP, Microsoft Azure, or another public cloud service
4+ years of experience in at least one of the following: Java, Scala, Python, Go, Javascript/TypeScript, Angular/React.js, or Node.js
2+ years of experience working with big data technologies (e.g. Hadoop, Spark, Presto)
2+ years of experience working on streaming data applications (e.g. Kafka, Kinesis, Flink, or Spark Streaming)
4+ years of experience in open source frameworks
At this time, Capital One will not sponsor a new applicant for employment authorization for this position.",4.0,"Capital One
4.0","San Francisco, CA",-1,10000+ Employees,1994,Company - Public,Banks & Credit Unions,Finance,$10+ billion (USD),-1
5,Software engineer,San Francisco,Pipeline Software Engineer,-1,"Aechelon Technology, Inc. is a leading producer of 3D simulator content, including Geospecific visual/sensor databases and realistic 3D models. We seek people who share our passion for real-time computer graphics and commitment to our mission of helping make our Nation’s pilots safer. We will give you a chance to work with some of the most talented people in the graphics industry.

Our Software Team is looking for Pipeline Engineers. The Pipeline Engineer’s primary role is to support our art team by designing tools and automating processes for the content creation pipeline. The primary workplace for this position will be in our San Francisco office.

United States citizenship required due to restrictions on access to certain data.
Primary Tasks:
Assist in the design, development, testing and maintaining of new tools or updates to existing tools
Write Python scripts to automate areas of the pipeline
Help ensure our user interface and processes have consistency across different tools and software platforms
Develop Maya and Photoshop plugins and scripts to enhance and streamline our production pipeline
Minimum Qualifications:
3+ years of experience in content creation software design, development and integration for CGI or game development
In depth experience in developing content creation tools and plug-ins with scripting languages such as Python, including integration of C/C++ libraries into Python programs
Development experience creating plug-ins and pipeline automation within Maya and Photoshop.
Strong analytical and problem-solving skills, and ability to bridge the creative and technical aspects of graphics
Eligibility to work with export-controlled technology
Preferred Qualifications:
Experience with user interface development and design using Qt and pyQt / pySide
Experience in C and C++ programming for 3D graphics
Experience with performance optimizations in realtime simulations/games
Experience with Google Earth, GIS tools such as ArcInfo or remote sensing tools such as Erdas or Envi.
BS in Engineering, Computer Science or similar technical field
We offer a very attractive compensation package including competitive base salary, company performance-based profit sharing, 401k, 100% employer paid health benefits (medical, dental, vision, life, std, ltd, and life insurance plans).
No relocation reimbursement provided.
For more information about our company, please visit www.aechelon.com

Aechelon Technology is an equal opportunity employer. We are committed to providing access and opportunities to individuals with disabilities. If you are an applicant who is unable to fully utilize/access our application process because of a disability, Aechelon Technology will provide a reasonable accommodation. Please send an email to hr_team@aechelon.com to request that accommodation, and please be sure to include a detailed description of your requested accommodation, your name and preferred method of contact.",2.9,"Aechelon Technology Inc.
2.9","San Francisco, CA",-1,51 to 200 Employees,-1,Company - Private,Computer Hardware & Software,Information Technology,$10 to $25 million (USD),-1
6,Software engineer,San Francisco,"Software Engineer, Keyless Entry",-1,"Leading the future of luxury mobility

Lucid’s mission is to inspire the adoption of sustainable energy by creating the most captivating luxury electric vehicles, centered around the human experience. Working at Lucid Motors means having a shared vision to power the future in revolutionary ways. Be part of a once-in-a-lifetime opportunity to transform the automotive industry.

We are currently seeking an Software Engineer, Keyless Entry Our ideal candidate exhibits a can-do attitude and approaches his or her work with vigor and determination. Candidates will be expected to demonstrate excellence in their respective fields, to possess the ability to learn quickly and to strive for perfection within a fast-paced environment.

The Role
Design and develop Keyless Entry software on the Telematics Module
Architect Software to work with multi-core processor environment.
Provide design, development, and debug support for integrating individual functions into the control unit.
Ensure optimization of software through design reviews and code reviews.
Develop a design and/or product validation test program to ensure robustness of design.
Integrate with different teams such as Cloud, Powertrain, Data Science etc to realize the project.
Qualifications
Strong proficiency in C and C++, and object oriented design.
Strong understanding of Data Structures and Algorithms.
Strong knowledge of Networking protocols such as TCP/UDP, MQTT, etc.
Working knowledge of Automotive Protocols such as CAN, UDS, etc.
Experience with integration with Automotive ECUs.
Experience with Phone-As-a-Key implementation is a big plus.
Experience with scripting languages/tools and methods to optimize SW development and testing activities.
At least 5-15+ years of industry experience
MS/BS minimum in the areas of Computer Science, Computer engineering, Electrical engineering or other related fields or equivalent experience
LMHP

Be part of something amazing

Come work alongside some of the most accomplished minds in the industry. Beyond providing competitive salaries, we’re providing a community for innovators who want to make an immediate and significant impact. If you are driven to create a better, more sustainable future, then this is the right place for you.

At Lucid, we don’t just welcome diversity - we celebrate it! Lucid Motors is proud to be an equal opportunity workplace and is an affirmative action employer. We are committed to equal employment opportunity regardless of race, color, national or ethnic origin, age, religion, disability, sexual orientation, gender, gender identity and expression, marital status, and any other characteristic protected under applicable State or Federal laws and regulations.

To all recruitment agencies: Lucid Motors does not accept agency resumes. Please do not forward resumes to our careers alias or other Lucid Motors employees. Lucid Motors is not responsible for any fees related to unsolicited resumes.",3.8,"Lucid Motors
3.8","Newark, CA",-1,1001 to 5000 Employees,2007,Company - Private,Transportation Equipment Manufacturing,Manufacturing,Unknown / Non-Applicable,-1
