,Position,City,Job Title,Salary Estimate,Job Description,Rating,Company Name,Location,Headquarters,Size,Founded,Type of ownership,Industry,Sector,Revenue,Competitors
146,Software engineer,San Francisco,"Software Engineer, University Graduate",-1,"Position Overview


SingleStore Software Engineers are at the forefront of real-time technology that's revolutionizing how companies run their businesses everyday. With release cycles throughout the year, our engineers are accustomed to moving quickly in a rapid production environment. To do this successfully, we work collaboratively and creatively across teams to maximize our opportunity for impact. We also believe it's important to celebrate our wins together whether it be at local spot or getting out of the city for some exploring.

As a Software Engineer, you will be empowered to own your projects end-to-end and be an active contributor throughout the product life cycle. To expedite your growth path, you will partner with engineers who deeply care about your success and will lend their expertise to your professional development. Our engineers are not just technical partners, but are also business partners who are exposed to all areas of the business, working with teams such as product, marketing, and sales.

Role and Responsibilities


Our Software Engineers work on small, collaborative teams to help drive our company forward. Whether you're building new features in Javascript and React.js, increasing the runtime and performance of a SingleStore cluster, or writing new C++ code for the query optimizer, our University Graduates are responsible for brand new and existing projects that are deployed into production with each release. Your work will include everything from writing to testing software, and you'll gain a significant understanding of both the product and the business.

Required Skills and Experience
B.S. Degree in Computer Science, Electrical Engineering, Computer Engineering, or related discipline
Deep understanding of C.S. fundamentals
Strong programming skills with Python, Go, C, C++, or JavaScript
Passionate about building highly reliable software
Firm grasp of algorithms and data structures
SingleStore is one platform for all data, built so you can engage with insight in every moment. Trusted by industry leaders, SingleStore enables enterprises to adapt to change as it happens, embrace diverse data with ease, and accelerate the pace of innovation. SingleStore is venture-backed and headquartered in San Francisco with offices in Portland, Seattle, Boston, Bangalore, London, Lisbon, and Kyiv. Defining the future starts with The Database of Now™.

Consistent with our commitment to diversity & inclusion, we value individuals with the ability to work on diverse teams and with a diverse range of people.

To all recruitment agencies: SingleStore does not accept agency resumes. Please do not forward resumes to SingleStore employees. SingleStore is not responsible for any fees related to unsolicited resumes and will not pay fees to any third-party agency or company that does not have a signed agreement with the Company.",4.6,"SingleStore
4.6","San Francisco, CA",-1,201 to 500 Employees,2011,Company - Private,Enterprise Software & Network Solutions,Information Technology,Unknown / Non-Applicable,-1
147,Software engineer,San Francisco,"Senior Software Engineer, Data Systems",-1,"The Senior Software Engineer position in Amobee's Platform Data team is a hands-on role that contributes to Amobee's success through expertise in large-scale systems and advanced database architecture. You will leverage the Hadoop ecosystem to create the next generation of our analytics product. Qualified individuals will have a solid background in the fundamentals of computer science, distributed computing and large-scale data processing.

Responsibilities:

Build BigData systems – work on improving and adding new functionality to Amobee’s Data Systems backbone.
Design and implement features evolving our online advertising and data management product offerings.
Design, implement our proprietary cutting edge Hadoop/Spark based systems
Scale up and tune our ad serving pipeline. Challenges come in the form of concurrency, data scale, and computational efficiency
Large-scale data ingestion and integration – design, implement scalable ETL processes to collect and store large amount of data from multiple data centers and diverse external partners
Predictive analytics – design, implement our analytics platform for our customers to discover potential new consumers
Real-time query engine – design, implement our state-of-the-art in-memory query engine to bring quick insights to customers
Collaboration on requirements – Work with the Engineering, Product Management and Sales teams to come up with features that would help us and our clients be more productive and improve the bottom line
Keep it running – Help troubleshoot application operational issues

Qualifications:

A degree in Computer Science is preferred
Must be hard working, team oriented, bright, creative, cooperative, and an exceptional problem solver
Experience with Java or Scala preferred experience with C++ or C# is acceptable
Experience with Hadoop (MapReduce, Spark), or similar, large-scale data processing systems is preferred
Proficiency in relational and NoSQL databases is preferred
Some experience with distributed systems, advanced applications building, large-scale data processing or application partitioning
Experience with AWS and working knowledge of AWS data management, DevOps processes and technologies (Jenkins/Travis, Docker, Kubernetes, monitoring systems, etc) is a plus
3+ years of relevant experience (appropriate PhD program project work acceptable)
Good understanding of Object Oriented programming and design
Strong knowledge of common algorithms and data structures
Solid understanding and working knowledge of modern operating systems and/or application scalability techniques is a plus
Experience with Linux based operating systems is a plus
About Amobee
The world’s leading independent advertising platform, Amobee unifies all advertising channels—including TV, programmatic and social—across all formats and devices. We provide marketers with streamlined, advanced media planning capabilities powered by in-depth analytics and proprietary audience data. Our platform and technology, provides the most advanced advertising solutions for the convergence of digital and advanced TV— including linear TV, over the top, connected TV, and premium digital video. Enabling advertisers to plan and activate across more than 150 integrated partners, including Facebook, Instagram, Pinterest, Snapchat and Twitter.

Amobee has been named to Fortune’s Top 10 Best Workplaces in Advertising and Marketing. Amobee’s platforms have been widely recognized amongst our industry winning numerous awards in technology innovation, see all Amobee Awards. We are a wholly owned subsidiary of Singtel, one of the largest telco companies in the world, reaching over 700 million mobile subscribers in 21 countries. Amobee operates across North America, Europe, Middle East, Asia and Australia. For more information, visit amobee.com or follow @amobee

In addition to our great environment, we offer a competitive base salary, employee development programs and other comprehensive benefits. Please send a cover letter along with your resume when applying to the position of interest located at Amobee.com. We are an Equal Opportunity Employer. No phone calls and no recruiting agencies, please.",3.8,"Amobee
3.8","Redwood City, CA",-1,501 to 1000 Employees,2005,Company - Private,Advertising & Marketing,Business Services,$500 million to $1 billion (USD),-1
148,Software engineer,San Francisco,"Senior Software Engineer, Frontend",-1,"What You'll Be Doing


At Fictiv, we help product innovators to create. Fictiv brings a modern, friendly experience to manufacturing that makes it easy to turn designs into real products. You will use the latest technologies (React, Redux, Apollo GraphQL) to iterate quickly and ensure a rapid feedback loop between us and our customers.

Senior engineers are the heart of our engineering team at Fictiv. As a Senior Engineer, you will be the hands-on technical anchor for your team. You will guide decisions from inside a project and lead us to build thoughtful, intuitive web applications with modular, well-structured components. You are a champion for the quality of our product, a key contributor to our architecture, and the go-to expert for upleveling the skills of our engineers.

Desired traits
Bring out the best in the team You use influence and knowledge to lift the team to high standards of excellence not only in application design and code quality but also in collaboration and development practices.
Technical expertise You have extensive experience building performant, scalable web applications. You think deeply about how data is fetched, cached, and updated to provide a seamless user experience.
Deliver quality You have a high attention to detail and hold both yourself and your colleagues accountable for shipping polished, well-tested code.
Team-oriented You have a strong desire to help the entire team level up and improve our collective craft. You understand, as a leader, the outsized impact of your actions and behaviors.
What It's Like to Work at Fictiv


We're a small, close-knit team with a core group in San Francisco and a few remote engineers around the country. While all engineers need protected time to get things done, we also believe collaboration and creative tension create the best product. That's why we encourage a rhythm of heads down, independent work followed by focused constructive debate.

Product development teams follow the principles from the Scrum Guide. We're practical about process (we use what works), but we've found Scrum ceremonies to be a positive framework for transparency and collaboration. To save time, we keep Sprint Plannings to 1 hour and Sprint Reviews to 45 minutes for our two-week sprints.

Since we are a small team, all engineers (including managers) are on-call for two weeks out of every 8-10 weeks. This builds team cohesion and deepens our understanding of our production system. We are all here to support one another, so if you have personal events during this time we're happy to swap slots or cover for you.

We're constantly evolving our practices, so please feel free to ask questions and share your thoughts as well!

What's In It For You


We strive to contribute to the well-being of our team beyond Health (of which we pay 85% per employee and 60% for dependents which an increase in contribution in January), Dental and Vision insurance. We offer our team members the following:
Investment in Health & Wellness (we offer everything from virtual vinyasa to pilates classes)
Access to professional development & coaching with additional free membership with Udemy, offering virtual learning via access to 4,000 courses
Equal maternity & paternity leave
Ergonomic investment in your personal/home office while working virtually
Investment in Diversity & Inclusion (executive-sponsored D&I programs)
Community days where you contribute to your community and enrich both yourself and organizations of your choice. Each year, you can use up to two days as community days.
Happy hours and demo days to showcase what you're working on and AMA's from the Executive team!
About Fictiv (www.fictiv.com)


At Fictiv, we're inspired every day by our customers and teammates.

We support a community that includes some of the most talented people on the planet. You'll design for hardware engineers who are literally building the future today (think autonomous vehicles, spaceships, next-gen medical devices) and partner with some of the most skilled manufacturers who produce the seemingly impossible.

For decades, these innovators have had to endure long feedback cycles and high upfront costs to bring their products to market. Our system drastically reduces the time and cost while allowing hardware engineers to experiment faster and with better outcomes. Come play a critical role in shaping this system into becoming the go-to platform for hardware development.

We're actively seeking potential teammates who can bring diverse perspectives and experience to our culture and company. We believe inclusion is the best way to create a strong, empathetic team. Our belief is that the best team is born from an environment that emphasizes respect, honesty, collaboration, and growth.

We encourage applications from members of underrepresented groups, including but not limited to women, members of the LGBTQ community, people of color, people with disabilities, and veterans.",4.1,"Fictiv
4.1","San Francisco, CA",-1,51 to 200 Employees,2013,Company - Private,Consumer Products Manufacturing,Manufacturing,Unknown / Non-Applicable,-1
149,Software engineer,San Francisco,Workday Software Engineer,-1,"JOB REQUISITION

Workday Software Engineer

LOCATION

SAN RAMON

JOB DESCRIPTION

Robert Half is seeking a Software Engineer to support Workday SaaS solution for our Corporate Human Resources and Payroll organization. Primary responsibilities include building complex integrations using web service technologies, SOAP, REST, WSDL, XML, XSLT and providing technical expertise on Workday Studio technologies, security, troubleshooting system issues, data analysis, vendor management and coordination with other teams.

Candidate should be proficient in web service/SOAP/REST/XML/XSLT coding – on job training on Workday SaaS toolset will be offered to well-qualified candidate. In addition, this role will analyze technical and systems problems and recommend automated solutions, processes and procedures for improvement. The qualified individual is required to create system specifications, write code, configure system settings, and execute unit, integration and acceptance testing. The individual will also lead cross-functional teams to address system, interface, data and vendor issues. There will be opportunities to work on Workday and other HR SaaS systems with general support, enhancements, and new projects.

Qualifications

Bachelor’s degree or above.
3+ years of developer experience.
2+ years’ experience with business applications.
Performs Software Engineer duties on the Workday product suite, specializing and leading integration work for a particular functional area such as HCM, Benefits, Compensation, Payroll, Talent, or Absence Management.
Experience with web service integrations (SOAP, REST, WSDL, and XML).
Working knowledge of XSLT.
Working knowledge of XSLT editors, such as Oxygen.
Experience with iterative or agile software development methodologies.
Provides estimates on effort, defining requirements, designing and developing the solution using the Workday Integration Tool Kit - Core Connectors, EIBs, Document Transforms, and Workday Studio.
Shares knowledge and information through regular communications and facilitation.
Ability to work at his/her own direction and balance competing priorities and customer needs.
Completes his or her own assignments on time and with quality and suggests opportunities for quality and process improvements.
Debugs and triages integration issues and defects. Implements and tests fixes where necessary.
Manages interface schedules to client SLAs. Defines client interface calendar and inventory, monitors integrations to completion, establishes and supports file transmission automation and supporting documentation.
Supports the RH team through test execution, issue triage and knowledge transfer activities.
Clearly and succinctly documents communications to customers using issue management system.
Replicates and verifies customer problems to identify potential solutions.
Collaborates with team members to research, identify and validate issue resolutions.
Effectively prioritizes customer issues as required.
Supports client and client teams in creating complex reports and resolving issues with existing reports.
Maintains integration related requirements and technical documentation.
Understands business requirements, configures the solution, develops prototype systems and assists with testing.
Understands the importance of testing, and executes it thoroughly.
Ability to work effectively with business and technology management and staff
Excellent analytical, problem solving, and multi-tasking skills.
Ability to work independently and perform against tight deadlines and multi-task effectively.
Strong self-motivation balanced with a desire to achieve team goals.
Working knowledge of object-oriented and relational model concepts.
Provides “outside the box” thinking and creative solutions for uncommon issues and new or soon-to-be-released Workday enhancements.

At Robert Half, there’s more to us than what we do. Learn about our values and what it’s like to work for the largest specialized staffing firm in the world at our San Ramon, California, Corporate Services office. Take a look!

Follow us on Twitter @RH_Corp_Jobs for Robert Half Corporate Services job openings and career and workplace news!

Robert Half International Inc. is an Equal Opportunity Employer. M/F/Disability/Veteran

As part of Robert Half’s Corporate Services facility employment process, any offer of employment is contingent upon successful completion of a background check.

Robert Half is committed to being an equal employment employer offering opportunities to all job seekers, including individuals with disabilities. If you believe you need a reasonable accommodation in order to search for a job opening or to apply for a position, please contact us by sending an email to corporaterecruiting@roberthalf.com for assistance.

In your email please include the following:

The specific accommodation requested to complete the employment application.
The location(s) (city, state) to which you would like to apply.

To apply:

You may apply for this position by email or regular mail. Please send your cover letter and resume to:

By email:

corporaterecruiting@roberthalf.com

By mail:

Corporate Staffing

Robert Half

2613 Camino Ramon

San Ramon, CA 94583-9128

JOB LOCATION

CA SAN RAMON CORP

ADDITIONAL LOCATION",-1,Robert Half Corporate Internal,"San Ramon, CA",-1,-1,-1,-1,-1,-1,-1,-1
150,Software engineer,San Francisco,"Software Engineer, Perception, Trucking",-1,"Waymo is a self-driving technology company with a mission to make it safe and easy for people and things to get where they're going. Since our start as the Google Self-Driving Car Project in 2009, Waymo has been focused on building the World's Most Experienced Driver in hopes of improving the world's access to mobility while saving thousands of lives now lost to traffic crashes. Our Waymo Driver powers Waymo One, our autonomous ride-hailing service, as well as Waymo Via, our trucking and local delivery service. To date, Waymo has driven over 20 million miles autonomously on public roads across 25 U.S. cities and conducted over 15 billion miles of simulation testing.

As Waymo becomes a multi-product company, Trucking will be our second largest opportunity and will see massive growth in 2020 as we tackle the unique challenges that it presents. We believe that commercial trucking, the backbone of our economy, stands to reap untold benefits by deploying autonomous trucks, particularly during long-haul stretches. Roads will be safer. Goods will be cheaper. Truckers will be called upon to use their skills in new ways while the truck itself becomes a trusted navigation partner.

In this role, you'll be working with a small but rapidly growing team, benefitting from shared technology and expertise of the greater Waymo and Alphabet organizations. We are looking for software engineers and roboticists who are passionate about evolving the safety-critical perception system for self-driving trucks beyond the state of the art.

Responsibilities:
Adapt and extend existing perception systems for deployment on a fleet of Waymo trucks, while creating all-new approaches where needed
Evaluate and understand the cross-functional, trucking-specific challenges that need to be tackled to operate a large fleet of autonomous trucks safely and efficiently
Prototype and deploy robust and reliable solutions to cutting-edge driving problems
Improve how our vehicles act and react in complex, nuanced, and rare situations
Minimum Qualifications:
BS in Robotics, Computer Vision, Machine Learning, similar technical field of study, or equivalent practical experience
Experience in programming in C++ and with robust, safety-critical, efficient code
Experience in at least one of: robotics, machine learning for perception, computer vision, LIDAR, autonomous systems, sensor fusion, pattern recognition, localization and mapping
Experience in data structures and advanced algorithms
Preferred Qualifications:
M.Sc. or Ph.D. in robotics, computer vision, autonomous systems or a related field
Extensive experience in robotics/autonomous systems
Experience with radar
Industry research or production experience",3.3,"Waymo
3.3","San Francisco, CA",-1,Unknown,2009,Company - Private,Computer Hardware & Software,Information Technology,Unknown / Non-Applicable,-1
151,Software engineer,San Francisco,Backend Software Engineer,-1,"Dubbed an ""open-source unicorn"" by Forbes, Confluent is the fastest-growing enterprise subscription company our investors have ever seen. And how are we growing so fast? By pioneering a new technology category with an event streaming platform, which enables companies to leverage their data as a continually updating stream of events, not as static snapshots. This innovation has led Coatue Management, Altimeter Capital and Franklin Templeton to join earlier investors Sequoia Capital, Benchmark, and Index Ventures in the recent Series E financing of a combined $250 million at a $4.5B valuation. Our product has been adopted by Fortune 100 customers across all industries, and we’re being led by the best in the space—our founders were the original creators of Apache Kafka®. We’re looking for talented and amazing team players who want to accelerate our growth, while doing some of the best work of their careers. Join us as we build the next transformative technology platform!

About the Team

The next big goal for Confluent is to make it as easy as possible for anyone to use Confluent’s products, including Kafka, to build their next killer streaming application. We are at the beginning of this journey and are looking for great engineers to come join our world-class team that is passionate about building and running large scale, multi-tenant distributed systems for customers that expect a very high level of availability. Our backend engineering teams are driven by a set of diverse challenges to:
Bridge data connectivity between various data systems and Kafka by building highly available and scalable Confluent connectors that run on top of Apache Kafka Connect framework
Build foundational cloud frameworks and services that power all components of the platform in the Cloud. The services cover domains of billing, security, org hierarchy, marketplace integrations, to name a few, and involve working on various aspects of our multi-cloud and multi-tenant solution at different levels of the backend stack.
Who You Are:

Smart, humble, and empathetic
Have a strong sense of teamwork and put team’s and company’s interests first
Driven and excited about challenges of a fast-paced, innovative software startup environment

Responsibilities:

Build mission-critical backend services that deliver value to our customers. You will play a crucial role in architecting, designing, developing and operationalizing high performance, scalable, reliable and resilient services
Troubleshoot and debug technical issues inside a deep and complex technical stack that includes microservices, containers, and virtualization
Ensure operational readiness of the services and meet the availability and performance SLA commitments to our customers
A strategic engineer who constantly thinks of process and operational improvements

What We're Looking For:

4+ years industry experience designing, building and supporting backend systems in production with a solid grasp on good software engineering practices such as code reviews, deep focus on quality, and documentation
Direct experience building systems with online components that serve user request
Strong programming and algorithmic skills. Proficiency in a major programming language, e.g. Java, Go, C / C++, Python, etc.
BS, MS, or PhD in computer science or a related field, or equivalent work experience

What Gives You An Edge:

Large public clouds: AWS, GCP, AzureDocker, Kubernetes
Familiarity with Kafka or Kafka Connect
SaaS platform development
Come As You Are

At Confluent, equality is a core tenet of our culture. We are committed to building an inclusive global team that represents a variety of backgrounds, perspectives, beliefs, and experiences. The more diverse we are, the richer our community and the broader our impact.

Click here to review our California Candidate Privacy Notice, which describes how and when Confluent, Inc., and its group companies, collects, uses, and shares certain personal information of California job applicants and prospective employees.",4.4,"Confluent
4.4","Mountain View, CA",-1,501 to 1000 Employees,2014,Company - Private,Computer Hardware & Software,Information Technology,$100 to $500 million (USD),-1
